ulasan,sentimen
aplikasi ini sangat bagus dan sangat membantu,Positif
saya sangat puas dengan fitur barunya,Positif
pelayanan sangat baik dan sangat responsif,Positif
sangat mudah digunakan dan sangat bermanfaat,Positif
aplikasi terbaik yang sangat keren,Positif
pelayanan sangat buruk dan sangat mengecewakan,Negatif
sering error dan sangat lambat sekali,Negatif
sistem sangat jelek dan sangat mengecewakan,Negatif
jangan download karena sangat buruk sekali,Negatif
sangat mengecewakan dan sangat lambat sekali,Negatif
tampilan biasa saja dan fitur standar saja,Netral
navigasi biasa saja dan fitur standar saja,Netral
kualitas biasa saja dan fitur standar saja,Netral
performa biasa saja dan fitur standar saja,Netral
fungsi biasa saja dan fitur standar saja,Netral